Keyword;Search Volume;CPC;Competition;Number of Results;Trends;Intent;Keyword Difficulty Index
snowflake cost optimization;260;22.23;0.77;106;0.21,0.26,0.26,0.39,0.39,0.26,0.09,0.09,0.48,0.59,0.39,0.39;1;27
best snowflake cost optimization tools;140;0;0;126;0.07,0.65,1.00,0.80,0.42,0.15,0.19,0.15,0.15;0;1
snowflake cost optimization solutions;140;0;0;113;0.23,1.00,1.00,0.80,0.66,0.14,0.00,0.09,0.14;1;24
snowflake cost optimization companies;110;0;0;5490000;0.52,1.00,0.82,0.64,0.41,0.17,0.23,0.17,0.17;0;0
snowflake cost optimization tools;110;15.14;0.16;4290000;0.06,0.06,0.06,0.43,1.00,0.65,1.00,0.65,0.21,0.28,0.21,0.43;1;26
best snowflake cost optimization software;90;0;0;143;0.64,1.00,0.78,0.50,0.35,0.14,0.07,0.07;0;3
seemore data snowflake cost optimization;90;0;0;153;0.64,1.00,1.00,0.78,0.64,0.35,0.07,0.21,0.00,0.00;1;3
snowflake cost optimization providers;90;0;0;2680000;0.50,1.00,1.00,0.64,0.35,0.07,0.00,0.00;1;13
snowflake cost optimization services;90;0;0;6700000;0.50,1.00,1.00,0.64,0.35,0.07,0.00,0.00;1;23
snowflake cost optimization tools for enterprise;90;0;0;4750000;0.50,1.00,1.00,0.78,0.50,0.14,0.21,0.14,0.21;1;7
snowflake cost optimization vendors;90;0;0;582000;0.52,1.00,0.82,0.64,0.41,0.11,0.23,0.23,0.23;1;0
best snowflake cost optimization platforms;70;0;0;121;0.64,1.00,0.78,0.28,0.21,0.14,0.35,0.28,0.28;0;9
snowflake cost optimization platforms;70;0;0;104;0.36,1.00,0.81,0.45,0.45,0.18,0.18,0.09,0.00;1;17
snowflake cost optimization software;70;0;0;5050000;0.81,1.00,0.63,0.27,0.27,0.09,0.00,0.00;1;20
vc backed startups optimizing cost on snowflake or databricks;70;0;0;6230;1.00,0.00,0.00,0.00;1;2
evaluate the data cost optimization company finout on snowflake migration;50;0;0;326000;0.63,0.63,0.45,1.00,0.81,0.36,0.09,0.18,0.00,0.18;1;15
evaluate the data cost optimization company select on snowflake migration;50;0;0;412000;0.09,0.81,0.63,1.00,0.63,0.27,0.18,0.27,0.00,0.18;1;13
finout cloud cost management snowflake cost optimization;50;0;0;2130;0.55,1.00,1.00,0.33,0.00,0.11,0.00,0.11;2;14
finout data cost optimization snowflake query optimization;50;0;0;89100;0.18,0.45,1.00,0.63,0.63,0.27,0.00,0.09,0.00,0.00;1;15
evaluate the data cost optimization company keebo on snowflake migration;40;0;0;249;0.71,0.28,0.14,1.00,1.00,0.71,0.14,0.14,0.00,0.00;1;1
monte carlo data snowflake cost optimization;40;0;0;98700;1.00,0.45,0.27,0.18,0.27,0.00,0.18,0.09,0.09;1;16
seemoredata snowflake cost optimization;40;0;0;14800;0.28,0.71,1.00,0.42,0.00,0.00;1,3;1
snowflake cost optimization best practices;40;20.14;0.18;105;0.18,0.18,0.18,1.00,0.18,0.18,0.81,0.27,0.18,0.18,0.18,0.18;0;29
snowflake egress cost optimizer;30;15.84;0.1;167;0.22,1.00,0.44,0.22,0.22,0.22,0.22,0.22,0.22,0.22,0.22,0.22;1,3;22
best cost visibility and optimization tool for snowflake;20;0;0;0;1.00,1.00,1.00,1.00,1.00;;0
best platform to manage snowflake cost optimization;20;0;0;0;1.00;;0
best snowflake cost optimization solutions;20;0;0;0;0.40,0.80,0.80,0.40,0.80,1.00,0.20,0.00,0.00;;0
cost optimization in snowflake;20;5.13;0.43;0;0.40,0.40,0.40,0.60,1.00,0.40,0.40,0.40,0.40,0.40,0.40,0.40;;0
cost optimization tools for snowflake;20;0;0;0;0.66,1.00,0.66,0.00,0.66,1.00,1.00,1.00,0.66;;0
egress cost optimizer snowflake;20;0;0.14;0;0.00,0.22,0.22,0.22,0.22,0.22,0.22,1.00,0.22,0.22,0.22,0.22;;0
snowflake cloud cost optimization;20;0;0;0;0.25,0.50,0.25,0.75,1.00,0.25,0.00,0.00,0.00,0.75,0.50,0.50;;0
snowflake cloud cost optimization software;20;0;0;0;0.25,0.50,0.25,1.00,1.00,0.50,0.25,0.50,0.00,1.00,0.75,0.75;;0
snowflake cloud cost optimization tools;20;0;0;0;0.25,0.50,0.50,0.75,1.00,0.75,0.50,0.50,0.25,0.25,0.50,0.50;;0
snowflake cost optimization ai automation 2025;20;0;0;0;0.14,1.00,0.42,0.00,0.00;;0
snowflake cost optimization for enterprise;20;0;0;0;0.00,1.00,0.71,0.14,0.14,0.00,0.00,0.00;;0
snowflake cost optimization techniques;20;0;0.43;0;0.40,0.40,0.40,1.00,0.60,0.40,0.40,0.40,0.60,0.40,0.40,0.40;;0
snowflake cost optimizer rockset;20;0;0;0;1.00,0.42,0.14,0.00,0.14,0.00;;0
snowflake search optimization cost;20;0;0.14;0;1.00,1.00,1.00,1.00,1.00,1.00,1.00,1.00,1.00,1.00,1.00,1.00;;0
wolfspeed snowflake cost optimization;20;0;0;0;1.00;;0
automated snowflake cost optimization with real-time alerting;10;0;0;0;1.00;;0
best snowflake cost optimization services tools for data-heavy companies;10;0;0;0;1.00;;0
best snowflake cost optimization tools 2025 2026;10;0;0;0;1.00;;0
finout data cost optimization snowflake migration;10;0;0;0;0.66,1.00,0.33,0.33,0.00,0.00,0.00,0.00,0.00;;0
finout snowflake cost optimization finout review;10;0;0;0;1.00,0.00,0.00,0.00,0.00,0.00;;0
how to automate snowflake cost optimization;10;0;0;0;1.00;;0
managed snowflake cost optimization service;10;0;0;0;1.00;;0
pluralsight flow snowflake cost optimization;10;0;0;0;1.00;;0
snowflake cost monitoring and optimization platforms;10;0;0;0;1.00,0.50,0.00,0.00,0.00;;0
snowflake cost optimization best practices 2025;10;0;0;0;1.00,1.00,1.00,0.00,0.50,0.50,0.00,0.00,0.00;;0
snowflake cost optimization for newly migrated data warehouses;10;0;0;0;0.00,1.00,1.00;;0